{
  "dslVersion": 3,
  "meta": {
    "title": "南京埃斯顿深度研究报告 AI 创意版",
    "author": "ppt-gen"
  },
  "theme": {
    "extends": "navy-report",
    "background": "#F6F4EF",
    "surface": "#FFFFFF",
    "surfaceAlt": "#EAEFF3",
    "border": "#D9DEE4",
    "primary": "#09192C",
    "accent": "#F26322",
    "accentText": "#B63A06",
    "onAccent": "#FFFFFF",
    "text": "#132238",
    "textSecondary": "#5B6879",
    "palette": ["#09192C", "#F26322", "#3B6F91", "#8CA6B8", "#C7D1D9", "#5B6879"]
  },
  "styleClasses": {
    "kicker": { "fontSize": 11, "fontStyle": "bold", "letterSpacing": 2.8, "fill": "$accentText" },
    "title": { "fontSize": 34, "fontStyle": "bold", "fill": "$text", "lineHeight": 1.12 },
    "titleDark": { "fontSize": 34, "fontStyle": "bold", "fill": "$white", "lineHeight": 1.12 },
    "body": { "fontSize": 17, "fill": "$text2", "lineHeight": 1.5 },
    "bodyDark": { "fontSize": 17, "fill": "#C7D1D9", "lineHeight": 1.5 },
    "small": { "fontSize": 13, "fill": "$text2", "lineHeight": 1.4 },
    "smallDark": { "fontSize": 13, "fill": "#AEBBC8", "lineHeight": 1.4 },
    "metric": { "fontSize": 58, "fontStyle": "bold", "fill": "$accentText", "lineHeight": 1 },
    "metricDark": { "fontSize": 58, "fontStyle": "bold", "fill": "$accent", "lineHeight": 1 },
    "panel": { "fill": "$surface", "stroke": "$border", "strokeWidth": 1, "cornerRadius": 14 },
    "darkPanel": { "fill": "$primary", "stroke": "$primary", "strokeWidth": 1, "cornerRadius": 14 },
    "hairline": { "lineColor": "$border", "lineWidth": 2 },
    "accentLine": { "lineColor": "$accent", "lineWidth": 3 },
    "label": { "fontSize": 15, "fontStyle": "bold", "fill": "$text" },
    "labelDark": { "fontSize": 15, "fontStyle": "bold", "fill": "$white" }
  },
  "slides": [
    {
      "id": "cover",
      "background": "$primary",
      "notes": "[Sources]\n- 南京埃斯顿深度研究报告.md：核心结论\n[/Sources]",
      "elements": [
        { "elType": "arc-segment", "cx": 1030, "cy": 360, "rOuter": 250, "rInner": 195, "startAngle": 205, "endAngle": 336, "fill": "$accent", "opacity": 0.9 },
        { "elType": "arc-segment", "cx": 1030, "cy": 360, "rOuter": 205, "rInner": 199, "startAngle": 20, "endAngle": 170, "fill": "$3", "arrow": false, "opacity": 0.8 },
        { "elType": "text", "styleClass": "kicker", "text": "ESTUN AUTOMATION  DEEP RESEARCH", "x": 78, "y": 92, "width": 540, "height": 26, "fill": "#C7D1D9" },
        { "elType": "text", "id": "hero", "text": "埃斯顿\n规模之后", "x": 78, "y": 190, "width": 650, "height": 154, "fontSize": 68, "fontStyle": "bold", "fill": "$white", "lineHeight": 1.04 },
        { "elType": "text", "text": "盈利修复与估值验证", "width": 620, "height": 44, "fontSize": 24, "fill": "#C7D1D9", "anchor": { "to": "hero", "edge": "bottom", "align": "left", "gap": 24 } },
        { "elType": "text", "text": "10.6%", "x": 800, "y": 250, "width": 400, "height": 105, "fontSize": 82, "fontStyle": "bold", "fill": "$accent", "align": "center", "verticalAlign": "middle" },
        { "elType": "text", "text": "2025年中国工业机器人市场份额\n首次超过四大家族", "x": 835, "y": 375, "width": 330, "height": 74, "fontSize": 17, "fill": "$white", "align": "center", "lineHeight": 1.45 },
        { "elType": "shape-line", "pointArr": [{ "x": 78, "y": 620 }, { "x": 560, "y": 620 }], "lineColor": "$accent", "lineWidth": 3 },
        { "elType": "text", "styleClass": "smallDark", "text": "研究日期  2026年9月3日", "x": 78, "y": 638, "width": 320, "height": 26 }
      ]
    },
    {
      "id": "thesis",
      "background": "$bg",
      "notes": "[Sources]\n- 南京埃斯顿深度研究报告.md：核心结论\n[/Sources]",
      "elements": [
        { "elType": "text", "styleClass": "kicker", "text": "INVESTMENT THESIS", "x": 70, "y": 52, "width": 320, "height": 24 },
        { "elType": "text", "text": "规模已经证明，\n利润和估值仍在等待证据", "x": 70, "y": 118, "width": 1040, "height": 150, "fontSize": 48, "fontStyle": "bold", "fill": "$text", "lineHeight": 1.12 },
        { "elType": "shape-line", "pointArr": [{ "x": 70, "y": 286 }, { "x": 1210, "y": 286 }], "lineColor": "$primary", "lineWidth": 4 },
        { "elType": "repeat", "id": "proof", "x": 70, "y": 330, "stepX": 390, "items": [
          { "number": "01", "title": "规模领先", "body": "2025年中国市场份额10.6%，连续八年位居国产品牌第一。", "color": "$primary" },
          { "number": "02", "title": "利润修复", "body": "2026H1扣非净利润0.70亿元，主业净利率仍约2.7%。", "color": "$accentText" },
          { "number": "03", "title": "估值前置", "body": "按一致预期计算，2026年动态PE约137倍。", "color": "$3" }
        ], "template": [
          { "elType": "shape-line", "pointArr": [{ "x": 0, "y": 0 }, { "x": 330, "y": 0 }], "lineColor": "{{color}}", "lineWidth": 5 },
          { "elType": "text", "text": "{{number}}", "x": 0, "y": 25, "width": 70, "height": 42, "fontSize": 24, "fontStyle": "bold", "fill": "{{color}}" },
          { "elType": "text", "text": "{{title}}", "x": 0, "y": 88, "width": 320, "height": 42, "fontSize": 24, "fontStyle": "bold", "fill": "$text" },
          { "elType": "text", "text": "{{body}}", "x": 0, "y": 150, "width": 320, "height": 100, "fontSize": 16, "fill": "$text2", "lineHeight": 1.5 }
        ] }
      ]
    },
    {
      "id": "tension",
      "background": "$primary",
      "notes": "[Sources]\n- 南京埃斯顿深度研究报告.md：核心结论、估值测算\n[/Sources]",
      "elements": [
        { "elType": "text", "styleClass": "kicker", "text": "THE CENTRAL TENSION", "x": 70, "y": 52, "width": 360, "height": 24, "fill": "$accent" },
        { "elType": "text", "styleClass": "titleDark", "text": "产业位置与盈利能力尚未处在同一高度", "x": 70, "y": 86, "width": 1020, "height": 54 },
        { "elType": "shape-line", "pointArr": [{ "x": 130, "y": 540 }, { "x": 520, "y": 220 }], "lineColor": "$3", "lineWidth": 10 },
        { "elType": "shape-line", "pointArr": [{ "x": 760, "y": 510 }, { "x": 1150, "y": 395 }], "lineColor": "$accent", "lineWidth": 10 },
        { "elType": "connector-s", "x1": 520, "y1": 220, "x2": 760, "y2": 510, "orientation": "h", "stroke": "#8CA6B8", "strokeWidth": 3, "dashType": "dash" },
        { "elType": "text", "styleClass": "metricDark", "text": "10.6%", "x": 120, "y": 260, "width": 360, "height": 90 },
        { "elType": "text", "styleClass": "bodyDark", "text": "中国市场份额\n出货量口径已经登顶", "x": 124, "y": 362, "width": 180, "height": 72 },
        { "elType": "text", "text": "约137×", "x": 810, "y": 315, "width": 340, "height": 90, "fontSize": 58, "fontStyle": "bold", "fill": "$white" },
        { "elType": "text", "styleClass": "bodyDark", "text": "2026E一致预期PE\n需要未来利润兑现", "x": 814, "y": 520, "width": 330, "height": 72 },
        { "elType": "text", "text": "价值兑现距离", "x": 505, "y": 570, "width": 270, "height": 38, "fontSize": 18, "fontStyle": "bold", "fill": "$accent", "align": "center" }
      ]
    },
    {
      "id": "global-demand",
      "background": "$bg",
      "notes": "[Sources]\n- 南京埃斯顿深度研究报告.md：行业分析2.1\n[/Sources]",
      "elements": [
        { "elType": "text", "styleClass": "kicker", "text": "DEMAND CURVE", "x": 70, "y": 48, "width": 260, "height": 24 },
        { "elType": "text", "styleClass": "title", "text": "全球需求继续扩张，增长重心转向亚洲", "x": 70, "y": 82, "width": 900, "height": 54 },
        { "elType": "text", "text": "70", "x": 1000, "y": 56, "width": 210, "height": 82, "fontSize": 64, "fontStyle": "bold", "fill": "$accentText", "align": "right" },
        { "elType": "text", "styleClass": "small", "text": "2028E全球安装量\n约70万台", "x": 1020, "y": 142, "width": 190, "height": 52, "align": "right" },
        { "elType": "chart", "chartType": "line", "x": 72, "y": 195, "width": 1136, "height": 390, "labels": ["2024", "2025E", "2028E"], "data": [{ "name": "全球安装量（万台）", "values": [54.2, 57.5, 70] }], "chartColors": ["#F26322"], "showLegend": false, "showValue": true },
        { "elType": "shape-rect", "x": 70, "y": 610, "width": 1140, "height": 54, "fill": "$primary", "cornerRadius": 27 },
        { "elType": "text", "text": "中国、东南亚和印度贡献主要增量，高端汽车与半导体仍决定价值量", "x": 110, "y": 620, "width": 1060, "height": 34, "fontSize": 16, "fontStyle": "bold", "fill": "$white", "align": "center", "verticalAlign": "middle" }
      ]
    },
    {
      "id": "localization",
      "background": "$bg",
      "notes": "[Sources]\n- 南京埃斯顿深度研究报告.md：行业分析2.1、2.2\n[/Sources]",
      "elements": [
        { "elType": "text", "styleClass": "kicker", "text": "LOCALIZATION INFLECTION", "x": 70, "y": 48, "width": 340, "height": 24 },
        { "elType": "text", "styleClass": "title", "text": "国产份额已经越过临界线", "x": 70, "y": 82, "width": 760, "height": 54 },
        { "elType": "text", "styleClass": "metric", "text": "57%", "x": 70, "y": 180, "width": 320, "height": 92 },
        { "elType": "text", "styleClass": "body", "text": "2024年本土厂商销量份额首次超过外资。\n量的拐点已经发生，价值量提升仍依赖高端场景突破。", "x": 72, "y": 292, "width": 430, "height": 112 },
        { "elType": "shape-line", "pointArr": [{ "x": 560, "y": 575 }, { "x": 1180, "y": 575 }], "lineColor": "$border", "lineWidth": 3 },
        { "elType": "repeat", "id": "bars", "items": [
          { "x": 0, "y": 250, "h": 180, "value": "63.5万套", "label": "2026年1至7月产量", "color": "$3" },
          { "x": 205, "y": 200, "h": 230, "value": "+28.5%", "label": "同期产量增速", "color": "$accent" },
          { "x": 410, "y": 145, "h": 285, "value": "62.9亿元", "label": "2026H1出口额", "color": "$primary" }
        ], "template": [
          { "elType": "shape-rect", "x": "{{x}}", "y": "{{y}}", "width": 150, "height": "{{h}}", "fill": "{{color}}", "cornerRadius": 10 },
          { "elType": "text", "text": "{{value}}", "x": "{{x}}", "y": "{{y}}", "width": 150, "height": 62, "fontSize": 24, "fontStyle": "bold", "fill": "$white", "align": "center", "verticalAlign": "middle", "bgFill": "{{color}}" },
          { "elType": "text", "text": "{{label}}", "x": "{{x}}", "y": 455, "width": 150, "height": 62, "fontSize": 13, "fill": "$text2", "align": "center", "lineHeight": 1.35 }
        ], "x": 585, "y": 145 }
      ]
    },
    {
      "id": "competitive-frontier",
      "background": "$bg",
      "notes": "[Sources]\n- 南京埃斯顿深度研究报告.md：竞争格局2.2、市场地位3.2\n[/Sources]",